[
  {
    "slug": "construction-project-team",
    "title": "建筑行业 Agent Team",
    "industry": "建筑行业 / Construction",
    "card_summary": "为缅甸建筑项目准备的基础团队，覆盖项目跟进、资料整理、报价成本、会议纪要、翻译和市场情报。",
    "use_cases": [
      "工程项目进度追踪",
      "图纸、合同、报价和验收资料整理",
      "业主、供应商和现场团队沟通",
      "缅甸本地材料与市场信息收集"
    ],
    "recommended_experts": [
      {
        "slug": "project-followup-assistant",
        "role": "项目跟进",
        "reason": "负责进度、任务、会议待办和跨团队追踪。"
      },
      {
        "slug": "document-organizer-master",
        "role": "工程资料整理",
        "reason": "把合同、图纸、RFI、验收资料和项目文件归档成可查结构。"
      },
      {
        "slug": "excel-data-cleanup-expert",
        "role": "数据与清单整理",
        "reason": "整理 BOQ、材料清单、采购台账和进度表。"
      },
      {
        "slug": "quotation-invoice-assistant",
        "role": "报价与发票",
        "reason": "辅助报价单、发票、付款节点和商务文档输出。"
      },
      {
        "slug": "meeting-minutes-assistant",
        "role": "会议纪要",
        "reason": "把项目会议、现场协调会和客户沟通整理成纪要与行动项。"
      },
      {
        "slug": "burmese-english-chinese-translator",
        "role": "缅英中沟通",
        "reason": "支持业主、供应商、现场团队之间的多语言沟通。"
      },
      {
        "slug": "myanmar-market-intel-expert",
        "role": "本地市场情报",
        "reason": "跟踪缅甸材料、供应商、行业动态和本地风险信息。"
      }
    ],
    "languages_supported": ["中文", "English", "မြန်မာ"],
    "channels_supported": ["Telegram", "Email", "Web", "Excel", "PDF"],
    "featured": true,
    "sort_order": 1
  },
  {
    "slug": "ecommerce-growth-team",
    "title": "电商增长 Agent Team",
    "industry": "电商行业 / Ecommerce",
    "card_summary": "面向 Facebook、Telegram 和本地电商运营，组合客服、广告、文案、回访、报价跟单和多语言支持。",
    "use_cases": [
      "订单咨询与售后自动化",
      "Facebook 页面回复和广告转化",
      "客户复购回访",
      "多语言销售沟通"
    ],
    "recommended_experts": [
      {
        "slug": "ecommerce-support-automation-expert",
        "role": "电商客服自动化",
        "reason": "处理订单问题、常见咨询、售后说明和客服 SOP。"
      },
      {
        "slug": "facebook-page-reply-expert",
        "role": "Facebook 页面回复",
        "reason": "提高评论、私信和页面咨询的响应速度。"
      },
      {
        "slug": "facebook-ads-assistant",
        "role": "广告投放",
        "reason": "辅助广告创意、受众、预算和数据复盘。"
      },
      {
        "slug": "social-copywriting-expert",
        "role": "社媒文案",
        "reason": "为商品、活动和促销生成适合本地平台的文案。"
      },
      {
        "slug": "quotation-followup-assistant",
        "role": "报价跟单",
        "reason": "跟进询价、报价、催单和成交转化。"
      },
      {
        "slug": "customer-followup-expert",
        "role": "客户回访",
        "reason": "沉淀客户反馈、复购机会和售后满意度。"
      },
      {
        "slug": "multilingual-support-expert",
        "role": "多语言客服",
        "reason": "支持中文、英文、缅文客服场景。"
      }
    ],
    "languages_supported": ["中文", "English", "မြန်မာ"],
    "channels_supported": ["Facebook", "Telegram", "Messenger", "Email"],
    "featured": true,
    "sort_order": 2
  },
  {
    "slug": "social-media-marketing-team",
    "title": "社交媒体营销 Agent Team",
    "industry": "社交媒体营销 / Social Media Marketing",
    "card_summary": "为内容生产、选题、广告、社媒回复和市场情报准备的轻量增长团队。",
    "use_cases": [
      "短视频与图文内容选题",
      "Facebook 广告与主页运营",
      "热点追踪和竞品观察",
      "本地化多语言内容输出"
    ],
    "recommended_experts": [
      {
        "slug": "content-topic-planner",
        "role": "内容选题",
        "reason": "根据账号定位、热点和用户画像规划内容主题。"
      },
      {
        "slug": "social-copywriting-expert",
        "role": "社媒文案",
        "reason": "输出 Facebook、TikTok、Telegram 可用的文案版本。"
      },
      {
        "slug": "facebook-ads-assistant",
        "role": "广告投放",
        "reason": "辅助广告结构、素材方向和投放复盘。"
      },
      {
        "slug": "facebook-page-reply-expert",
        "role": "主页互动",
        "reason": "提升评论区、私信和潜在客户承接效率。"
      },
      {
        "slug": "myanmar-market-intel-expert",
        "role": "市场情报",
        "reason": "跟踪缅甸市场趋势、竞品活动和本地热点。"
      },
      {
        "slug": "burmese-english-chinese-translator",
        "role": "本地化翻译",
        "reason": "把中文内容改写成英文或缅文表达。"
      }
    ],
    "languages_supported": ["中文", "English", "မြန်မာ"],
    "channels_supported": ["Facebook", "TikTok", "Telegram", "Web"],
    "featured": true,
    "sort_order": 3
  }
]
